Name,Artist,Album,Track Number
Dundadeova,Dzihan & Kamien,Destination Lounge San Francisco - Relax,8
All That We Perceive,Thievery Corporation,The Richest Man In Babylon,6
It's The Most Wonderful Time Of The Year (a shrift remix),Andy Williams,Christmas Remixed - Holiday Classics Re-Grooved,1
O Tannenbaum,Vince Guaraldi Trio,A Charlie Brown Christmas [Expanded] (Remastered),1
Happy Holiday (Beef Wellington Remix),Bing Crosby,Christmas Remixed - Holiday Classics Re-Grooved,2
Jingle Bells (Dan The Automator Remix),Dean Martin,Christmas Remixed - Holiday Classics Re-Grooved,3
1234 (Van She Remix),Feist,The Reminder Deluxe EP,1
I've Got My Love To Keep Me Warm (STUHR Remix),Kay Starr,Christmas Remixed - Holiday Classics Re-Grooved,4
Stiff Jazz (Zündapp Dub),Dzihan & Kamien,dZihan & Kamien Remixed,2
Telephone,Lady Gaga,The Fame Monster,6
Joy To The World (Mocean Worker Remix),The Cathedral Brass,Christmas Remixed - Holiday Classics Re-Grooved,5
Winter Wonderland (Rise Ashen's Brazilian Beach Mix),Johnny Mercer,Christmas Remixed - Holiday Classics Re-Grooved,6
Sound The Alarm,Thievery Corporation,Radio Retaliation,1
What Child Is This,Vince Guaraldi Trio,A Charlie Brown Christmas [Expanded] (Remastered),2
"Merry Christmas, Baby (MNO remix)",Charles Brown,Christmas Remixed - Holiday Classics Re-Grooved,7
The Nutcracker Suite (Baz Kuts Breaks Mix),Berlín Symphony Orchestra,Christmas Remixed - Holiday Classics Re-Grooved,8
Lebanese Blonde,Thievery Corporation,The Mirror Conspiracy,4
Jingle Bells (Robbie Hardkiss Remix),Duke Ellington,Christmas Remixed - Holiday Classics Re-Grooved,10
Linus & Lucy,Vince Guaraldi Trio,A Charlie Brown Christmas [Expanded] (Remastered),4
"Baby, It's Cold Outside (Mulato Beat Remix) (Mulato Beat remix)",Louis Armstrong,Christmas Remixed - Holiday Classics Re-Grooved,9
Basmati,Dzihan & Kamien,Gran Riserva,2
The First Noel (Attaboy House Party Mix),Bing Crosby,Christmas Remixed - Holiday Classics Re-Grooved,11
The Christmas Song (Michael Kessler Open Fire Mix),Mel Tormé,Christmas Remixed - Holiday Classics Re-Grooved,12
Heaven's Gonna Burn Your Eyes,Thievery Corporation,The Richest Man In Babylon,1
Get A Move On!,Mr. Scruff,Keep It Unreal,3
Bang Bang Bang,"Mark Ronson, The Business Intl.",Record Collection,1
Animal,Miike Snow,Miike Snow,1
Stylo (feat. Mos Def and Bobby Womack),Gorillaz,Plastic Beach,5
Fuck You,Cee-Lo,The Lady Killer,3
Cellphone's Dead,Beck,The Information,3
The High Road,Broken Bells,Broken Bells,1
Bulletproof,La Roux,La Roux,4
Dance Yrself Clean,LCD Soundsystem,This Is Happening,1
All Of The Lights,Kanye West,My Beautiful Dark Twisted Fantasy,5
Alejandro,Lady Gaga,The Fame Monster,2
Like A G6,Far East Movement,Free Wired,2
Dynamite,Taio Cruz,Rokstarr,1
Fire Burning (Album Version),Sean Kingston,Tomorrow,3
Only Girl (In The World),Rihanna,Loud,5
Anyway You Choose To Give It,The Black Ghosts,The Black Ghosts,2
Dancing On My Own,Robyn,Body Talk Pt. 1,3
Break Your Heart,Taio Cruz,Rokstarr,2
Rude Boy,Rihanna,Rated R,8
Bad Romance,Lady Gaga,The Fame Monster,1
Imma Be,The Black Eyed Peas,THE E.N.D. (THE ENERGY NEVER DIES),4
Strobe (Club Edit),deadmau5,Strobe,2
Paper Planes (DFA Remix),M.I.A.,Slumdog Millionaire - Music From The Motion Picture,5
Digital Love (Boris Dlugosh Remix),Daft Punk,Daft Club,6
Heartbeats,The Knife,Deep Cuts,1
Shutterbugg,Big Boi,Sir Lucious Left Foot...The Son Of Chico Dusty (Deluxe Edition (Explicit)),5
Rollin' (Dirty Edit),Jackie Chain,Rollin,1
Mesopotamia,The B-52's,Time Capsule,8
Beat It (Single Version),Michael Jackson,Thriller,5
Billie Jean (Single Version),Michael Jackson,Number Ones,3
I Gotta Feeling,The Black Eyed Peas,THE E.N.D. (THE ENERGY NEVER DIES),5
Life During Wartime (Remastered Version ),Talking Heads,The Best Of Talking Heads,6
Once In A Lifetime (Remastered Version ),Talking Heads,The Best Of Talking Heads,9
L.E.S. Artistes,Santigold,Santigold,1
Suffer For Fashion,of Montreal,"Hissing Fauna, Are You The Destroyer?",1
Love Shack,The B-52's,Time Capsule,13
Private Idaho,The B-52's,Time Capsule,6
Sledgehammer,Peter Gabriel,Shaking The Tree - 16 Golden Greats (Remastered),3
Under Pressure,David Bowie,Best Of Bowie,13
Breaking Glass (1999 Remastered Version),David Bowie,Low,2
Holiday Nights,DJ Sorama,Mugen Manga Melodies Vol. 1,11
